name,reviews,main_category,categories,rating,address,link,coordinates
Taman Pelangi Jogja,6057,Taman Hiburan,"[""Taman Hiburan"", ""Taman"", ""Tujuan Wisata""]",4.3,"Jl. Ring Road Utara, Jongkang, Sariharjo, Kec. Ngaglik, Kabupaten Sleman, Daerah Istimewa Yogyakarta 55284",https://www.google.com/maps/place/Taman+Pelangi+Jogja/data=!4m7!3m6!1s0x2e7a58f975c66097:0x99331d342ee5862d!8m2!3d-7.7503027!4d110.3694988!16s%2Fg%2F11x7vl1rr!19sChIJl2DGdflYei4RLYblLjQdM5k?authuser=0&hl=id&rclk=1,"{""latitude"": -7.7503027, ""longitude"": 110.36949879999999}"
Kawasan Wisata Malioboro,5186,Tujuan Wisata,"[""Tujuan Wisata""]",4.7,"Jl. Margo Mulyo Jl. Jend. Ahmad Yani No.106, Ngupasan, Kec. Gondomanan, Kota Yogyakarta, Daerah Istimewa Yogyakarta 55122",https://www.google.com/maps/place/Kawasan+Wisata+Malioboro/data=!4m7!3m6!1s0x2e7a578819c338f1:0x72aa3ad97ecccfb6!8m2!3d-7.7982487!4d110.3652793!16s%2Fg%2F11dd_kfc0g!19sChIJ8TjDGYhXei4Rts_Mftk6qnI?authuser=0&hl=id&rclk=1,"{""latitude"": -7.798248699999999, ""longitude"": 110.3652793}"
Pasar Sore Malioboro,3702,Pasar Loak,"[""Pasar Loak"", ""Tujuan Wisata""]",4.6,"6928+8C2, Jl. Jend. Ahmad Yani, Ngupasan, Kec. Gondomanan, Kota Yogyakarta, Daerah Istimewa Yogyakarta 55122",https://www.google.com/maps/place/Pasar+Sore+Malioboro/data=!4m7!3m6!1s0x2e7a57889294e623:0xbc443b8ba7b436d6!8m2!3d-7.7992325!4d110.3660017!16s%2Fg%2F1hm246mv_!19sChIJI-aUkohXei4R1ja0p4s7RLw?authuser=0&hl=id&rclk=1,"{""latitude"": -7.7992325, ""longitude"": 110.3660017}"
Plengkung Gading,2999,Tempat Bersejarah,"[""Tempat Bersejarah"", ""Tujuan Wisata""]",4.6,"Jl. Patehan Kidul No.4, Patehan, Kecamatan Kraton, Kota Yogyakarta, Daerah Istimewa Yogyakarta 55133",https://www.google.com/maps/place/Plengkung+Gading/data=!4m7!3m6!1s0x2e7a5796f097cf41:0x89fc8d46097f458b!8m2!3d-7.8137278!4d110.3629074!16s%2Fg%2F11btlnnlpx!19sChIJQc-X8JZXei4Ri0V_CUaN_Ik?authuser=0&hl=id&rclk=1,"{""latitude"": -7.8137278, ""longitude"": 110.3629074}"
Panggung Krapyak,2963,Bangunan Bersejarah,"[""Bangunan Bersejarah"", ""Tujuan Wisata""]",4.6,"Krapyak Kulon, panggung, krpayak, Kabupaten Bantul, Daerah Istimewa Yogyakarta 55188",https://www.google.com/maps/place/Panggung+Krapyak/data=!4m7!3m6!1s0x2e7a57b753031cad:0xec9485ff1320ab71!8m2!3d-7.8276355!4d110.3606071!16s%2Fg%2F11c5zs51gj!19sChIJrRwDU7dXei4RcasgE_-FlOw?authuser=0&hl=id&rclk=1,"{""latitude"": -7.8276354999999995, ""longitude"": 110.3606071}"
Jembatan Sayidan,2134,Jembatan,"[""Jembatan"", ""Tujuan Wisata""]",4.6,"59XC+9GJ, Jl. Sultan Agung, Prawirodirjan, Kec. Gondomanan, Kota Yogyakarta, Daerah Istimewa Yogyakarta 55121",https://www.google.com/maps/place/Jembatan+Sayidan/data=!4m7!3m6!1s0x2e7a578417f276ef:0x59d5c16a7bdfca7d!8m2!3d-7.8015418!4d110.3712511!16s%2Fg%2F11f106s78j!19sChIJ73byF4RXei4Rfcrfe2rB1Vk?authuser=0&hl=id&rclk=1,"{""latitude"": -7.8015418, ""longitude"": 110.3712511}"
Candi Ijo,1455,Pura,"[""Pura"", ""Tujuan Wisata""]",4.8,"Jl. Candi Ijo, Nglengkong, Sambirejo, Kec. Prambanan, Kabupaten Sleman, Daerah Istimewa Yogyakarta 55572",https://www.google.com/maps/place/Candi+Ijo/data=!4m7!3m6!1s0x2e7a5b1232407aa5:0x645c50631c5aaaeb!8m2!3d-7.783827!4d110.5118835!16s%2Fm%2F0s8ww5l!19sChIJpXpAMhJbei4R66paHGNQXGQ?authuser=0&hl=id&rclk=1,"{""latitude"": -7.783827, ""longitude"": 110.5118835}"
Masjid Margo Yuwono,939,Masjid,"[""Masjid"", ""Tujuan Wisata""]",4.8,"Jl. Langenastran Lor No.9, Panembahan, Kecamatan Kraton, Kota Yogyakarta, Daerah Istimewa Yogyakarta 55131",https://www.google.com/maps/place/Masjid+Margo+Yuwono/data=!4m7!3m6!1s0x2e7a5790cc9772bb:0x1f6f8bcfba3e40e6!8m2!3d-7.8114471!4d110.3647766!16s%2Fg%2F11gxgpc4sm!19sChIJu3KXzJBXei4R5kA-us-Lbx8?authuser=0&hl=id&rclk=1,"{""latitude"": -7.8114471, ""longitude"": 110.3647766}"
Gereja Sayidan,730,Bangunan Bersejarah,"[""Bangunan Bersejarah"", ""Tujuan Wisata""]",4.3,"59W9+HWP, Prawirodirjan, Kec. Gondomanan, Kota Yogyakarta, Daerah Istimewa Yogyakarta 55131",https://www.google.com/maps/place/Gereja+Sayidan/data=!4m7!3m6!1s0x2e7a57850056ca21:0xa8efa0b92ac530ca!8m2!3d-7.8035488!4d110.3698419!16s%2Fg%2F11h7dclrlr!19sChIJIcpWAIVXei4RyjDFKrmg76g?authuser=0&hl=id&rclk=1,"{""latitude"": -7.8035488, ""longitude"": 110.3698419}"
Bringin Kembar Alun-Alun Selatan (Masangin) Yogyakarta,501,Tempat Bersejarah,"[""Tempat Bersejarah"", ""Tujuan Wisata""]",4.7,"59Q7+67G, Patehan, Kecamatan Kraton, Kota Yogyakarta, Daerah Istimewa Yogyakarta 55133",https://www.google.com/maps/place/Bringin+Kembar+Alun-Alun+Selatan+%28Masangin%29+Yogyakarta/data=!4m7!3m6!1s0x2e7a5796d474c38b:0xa29ec3628bcfcdc0!8m2!3d-7.8119357!4d110.363194!16s%2Fg%2F11c464q4v6!19sChIJi8N01JZXei4RwM3Pi2LDnqI?authuser=0&hl=id&rclk=1,"{""latitude"": -7.811935699999999, ""longitude"": 110.363194}"
Omah UGM Kotagede Yogyakarta,275,Museum,"[""Museum"", ""Tujuan Wisata""]",4.7,"Bodon, Jagalan, Kec. Kotagede, Kota Yogyakarta, Daerah Istimewa Yogyakarta 55192",https://www.google.com/maps/place/Omah+UGM+Kotagede+Yogyakarta/data=!4m7!3m6!1s0x2e7a571415555555:0x298e76cc357e1d99!8m2!3d-7.8293112!4d110.3956256!16s%2Fg%2F11b_2xts7s!19sChIJVVVVFRRXei4RmR1-Ncx2jik?authuser=0&hl=id&rclk=1,"{""latitude"": -7.829311199999999, ""longitude"": 110.39562559999999}"
Taman Tino Sidin,269,Museum Seni,"[""Museum Seni"", ""Tujuan Wisata""]",4.7,"Jl. Tino Sidin No.297, Kdipiro, Ngestiharjo, Kec. Kasihan, Kabupaten Bantul, Daerah Istimewa Yogyakarta 55184",https://www.google.com/maps/place/Taman+Tino+Sidin/data=!4m7!3m6!1s0x2e7a57f7a67dd48d:0x3733d2276e53b089!8m2!3d-7.7995125!4d110.3449674!16s%2Fg%2F11g6_crbgh!19sChIJjdR9pvdXei4RibBTbifSMzc?authuser=0&hl=id&rclk=1,"{""latitude"": -7.7995125, ""longitude"": 110.3449674}"
Klenteng Poncowinatan,265,Vihara,"[""Vihara"", ""Tujuan Wisata""]",4.5,"Jl. Poncowinatan No.12-18, Gowongan, Kec. Jetis, Kota Yogyakarta, Daerah Istimewa Yogyakarta 55233",https://www.google.com/maps/place/Klenteng+Poncowinatan/data=!4m7!3m6!1s0x2e7a583a6db35027:0x8fdad0a9d21bc2cc!8m2!3d-7.7819564!4d110.3656838!16s%2Fg%2F11dztwz3lz!19sChIJJ1CzbTpYei4RzMIb0qnQ2o8?authuser=0&hl=id&rclk=1,"{""latitude"": -7.781956399999999, ""longitude"": 110.3656838}"
Museum Bahari - Jogja,225,Museum,"[""Museum"", ""Tujuan Wisata""]",4.4,"Jl. R. E. Martadinata No.69, Wirobrajan, Kabupaten Bantul, Daerah Istimewa Yogyakarta 55182",https://www.google.com/maps/place/Museum+Bahari+-+Jogja/data=!4m7!3m6!1s0x2e7a57f48f265911:0x4373216e201026a8!8m2!3d-7.8011406!4d110.3493008!16s%2Fg%2F1hdztbs4h!19sChIJEVkmj_RXei4RqCYQIG4hc0M?authuser=0&hl=id&rclk=1,"{""latitude"": -7.801140599999999, ""longitude"": 110.3493008}"
Monumen Batik Yogyakarta꧋ꦩꦺꦴꦤꦸꦩꦺꦤ꧀ꦧꦠꦶꦏ꧀ꦪꦺꦴꦒꦾꦏꦂꦠ,222,Monumen,"[""Monumen"", ""Tujuan Wisata""]",4.5,"59X7+HR5, Jl. KH. Ahmad Dahlan, Ngupasan, Kec. Gondomanan, Kota Yogyakarta, Daerah Istimewa Yogyakarta 55122",https://www.google.com/maps/place/Monumen+Batik+Yogyakarta%EA%A7%8B%EA%A6%A9%EA%A6%BA%EA%A6%B4%EA%A6%A4%EA%A6%B8%EA%A6%A9%EA%A6%BA%EA%A6%A4%EA%A7%80%EA%A6%A7%EA%A6%A0%EA%A6%B6%EA%A6%8F%EA%A7%80%EA%A6%AA%EA%A6%BA%EA%A6%B4%EA%A6%92%EA%A6%BE%EA%A6%8F%EA%A6%82%EA%A6%A0/data=!4m7!3m6!1s0x2e7a5788ccf98665:0x528f314a0e4136d4!8m2!3d-7.8011159!4d110.3646172!16s%2Fg%2F11bbx04r8z!19sChIJZYb5zIhXei4R1DZBDkoxj1I?authuser=0&hl=id&rclk=1,"{""latitude"": -7.801115899999999, ""longitude"": 110.3646172}"
Between Two Gates,209,Bangunan Bersejarah,"[""Bangunan Bersejarah"", ""Tujuan Wisata""]",4.7,"Jl. Masjid Besar No.905, Purbayan, Kec. Kotagede, Kota Yogyakarta, Daerah Istimewa Yogyakarta 55173",https://www.google.com/maps/place/Between+Two+Gates/data=!4m7!3m6!1s0x2e7a571ed79fac7b:0x4fdc3035ff68b9c5!8m2!3d-7.830939!4d110.3990766!16s%2Fg%2F11c0xtht4l!19sChIJe6yf1x5Xei4Rxblo_zUw3E8?authuser=0&hl=id&rclk=1,"{""latitude"": -7.830939, ""longitude"": 110.3990766}"
Pulo Kenanga,151,Bangunan Bersejarah,"[""Bangunan Bersejarah"", ""Tujuan Wisata""]",4.6,"59R5+FWW, Jl. Polowijan No.5, Patehan, Kecamatan Kraton, Kota Yogyakarta, Daerah Istimewa Yogyakarta 55133",https://www.google.com/maps/place/Pulo+Kenanga/data=!4m7!3m6!1s0x2e7a5793e5555555:0x671d03b55e0bf9e6!8m2!3d-7.8089581!4d110.3598416!16s%2Fg%2F1pzt1xyzd!19sChIJVVVV5ZNXei4R5vkLXrUDHWc?authuser=0&hl=id&rclk=1,"{""latitude"": -7.8089581, ""longitude"": 110.3598416}"
Sebastian Yogyakarta Tours꧋ꦄꦁꦏꦿꦶꦔꦤ꧀,113,Biro Perjalanan dan Wisata,"[""Biro Perjalanan dan Wisata"", ""Agen Tur Bus"", ""Agen Tur Keliling Kota"", ""Biro Wisata"", ""Penyelenggara Perjalanan"", ""Tujuan Wisata"", ""Pusat Informasi Pariwisata""]",4.9,"Jl. Krasak No.11, Kotabaru, gk II, Kota Yogyakarta, Daerah Istimewa Yogyakarta 55283",https://www.google.com/maps/place/Sebastian+Yogyakarta+Tours%EA%A7%8B%EA%A6%84%EA%A6%81%EA%A6%8F%EA%A6%BF%EA%A6%B6%EA%A6%94%EA%A6%A4%EA%A7%80/data=!4m7!3m6!1s0x2e7a5958bb04270b:0x383219484f66f4c6!8m2!3d-7.7886589!4d110.3730048!16s%2Fg%2F11h4zgrhtm!19sChIJCycEu1hZei4RxvRmT0gZMjg?authuser=0&hl=id&rclk=1,"{""latitude"": -7.7886589, ""longitude"": 110.37300479999999}"
Ndalem Jogonegaran,101,Bangunan Bersejarah,"[""Bangunan Bersejarah"", ""Tujuan Wisata""]",4.5,"6936+WV2, Pringgokusuman , Gedong Tengen , Yogyakarta , Daerah Istimewa Yogyakart, Sosromenduran, Gedong Tengen, Yogyakarta City, Special Region of Yogyakarta 55271",https://www.google.com/maps/place/Ndalem+Jogonegaran/data=!4m7!3m6!1s0x2e7a5827155f7a39:0x68947bcde35ef704!8m2!3d-7.795237!4d110.362155!16s%2Fg%2F1pzqczcfz!19sChIJOXpfFSdYei4RBPde4817lGg?authuser=0&hl=id&rclk=1,"{""latitude"": -7.795236999999999, ""longitude"": 110.362155}"
Roller Pop & Studiogram Yogyakarta,94,Arena Sepatu Roda,"[""Arena Sepatu Roda"", ""Tujuan Wisata""]",4.5,"Jl. Veteran No.150-151, Pandeyan, Kec. Umbulharjo, Kota Yogyakarta, Daerah Istimewa Yogyakarta 55161",https://www.google.com/maps/place/Roller+Pop+%26+Studiogram+Yogyakarta/data=!4m7!3m6!1s0x2e7a570f04d4be95:0x30a1e43dcd5fe894!8m2!3d-7.8163681!4d110.3866164!16s%2Fg%2F11kj73xlfs!19sChIJlb7UBA9Xei4RlOhfzT3koTA?authuser=0&hl=id&rclk=1,"{""latitude"": -7.8163681, ""longitude"": 110.3866164}"
Taman Kehati,55,Taman Kota,"[""Taman Kota"", ""Tujuan Wisata""]",4.5,"696P+GW8, Demangan, Kec. Gondokusuman, Kota Yogyakarta, Daerah Istimewa Yogyakarta 55221",https://www.google.com/maps/place/Taman+Kehati/data=!4m7!3m6!1s0x2e7a59d12057f9b1:0x83fc2342553d4c50!8m2!3d-7.7887054!4d110.3873403!16s%2Fg%2F11hchthf54!19sChIJsflXINFZei4RUEw9VUIj_IM?authuser=0&hl=id&rclk=1,"{""latitude"": -7.7887054, ""longitude"": 110.38734029999999}"
Situs Benteng Cepuri,43,Bangunan Bersejarah,"[""Bangunan Bersejarah"", ""Tujuan Wisata""]",4.5,"599X+FH7, Jl. Masjid Besar, Purbayan, Kec. Kotagede, Kota Yogyakarta, Daerah Istimewa Yogyakarta 55192",https://www.google.com/maps/place/Situs+Benteng+Cepuri/data=!4m7!3m6!1s0x2e7a571edc636189:0x1124e96fbf460566!8m2!3d-7.8313443!4d110.3989364!16s%2Fg%2F11hvh2_99j!19sChIJiWFj3B5Xei4RZgVGv2_pJBE?authuser=0&hl=id&rclk=1,"{""latitude"": -7.8313443, ""longitude"": 110.3989364}"
Malioboro Yogyakarta Indonesia,36,Tujuan Wisata,"[""Tujuan Wisata""]",4.9,"6948+W8Q, Jl. Malioboro, Sosromenduran, Gedong Tengen, Kota Yogyakarta, Daerah Istimewa Yogyakarta 55271",https://www.google.com/maps/place/Malioboro+Yogyakarta+Indonesia/data=!4m7!3m6!1s0x2e7a59a09badba5f:0x143793e2164c82d7!8m2!3d-7.7926389!4d110.3658611!16s%2Fg%2F11t4bg9wkq!19sChIJX7qtm6BZei4R14JMFuKTNxQ?authuser=0&hl=id&rclk=1,"{""latitude"": -7.7926389, ""longitude"": 110.36586109999999}"
LEMBAH WOLULAS,35,Tujuan Wisata,"[""Tujuan Wisata""]",4.3,"Giwangan, Kec. Umbulharjo, Kota Yogyakarta, Daerah Istimewa Yogyakarta 55163",https://www.google.com/maps/place/LEMBAH+WOLULAS/data=!4m7!3m6!1s0x2e7a571b80bedc17:0x21f16c776efbfef7!8m2!3d-7.8303282!4d110.3936026!16s%2Fg%2F11dfl5vrnc!19sChIJF9y-gBtXei4R9_77bnds8SE?authuser=0&hl=id&rclk=1,"{""latitude"": -7.830328199999999, ""longitude"": 110.3936026}"
Kampung Wisata Warungboto,31,Tujuan Wisata,"[""Tujuan Wisata""]",4.9,"Balai, Jl. Umbul Raya, RT.38/RW.09, Warungboto, Kec. Umbulharjo, Kota Yogyakarta, Daerah Istimewa Yogyakarta 55164",https://www.google.com/maps/place/Kampung+Wisata+Warungboto/data=!4m7!3m6!1s0x2e7a57e2083b1b59:0xd58c23699705d0d0!8m2!3d-7.8133932!4d110.392982!16s%2Fg%2F11rfd6mky3!19sChIJWRs7COJXei4R0NAFl2kjjNU?authuser=0&hl=id&rclk=1,"{""latitude"": -7.813393199999999, ""longitude"": 110.39298199999999}"
wisata ikan gajahwong,27,Tujuan Wisata,"[""Tujuan Wisata""]",4.9,"599V+GJ9, Giwangan, Kec. Umbulharjo, Kota Yogyakarta, Daerah Istimewa Yogyakarta 55163",https://www.google.com/maps/place/wisata+ikan+gajahwong/data=!4m7!3m6!1s0x2e7a5711040a5553:0x1e80a3dcf57a69d5!8m2!3d-7.8312141!4d110.3941223!16s%2Fg%2F11mhx1rcgj!19sChIJU1UKBBFXei4R1Wl69dyjgB4?authuser=0&hl=id&rclk=1,"{""latitude"": -7.8312140999999995, ""longitude"": 110.39412229999999}"
Kampung Wisata Prenggan Kotagede,24,Tujuan Wisata,"[""Tujuan Wisata""]",5.0,"Jl. Tegal Gendu No.20, Prenggan, Kec. Kotagede, Kota Yogyakarta, Daerah Istimewa Yogyakarta 55172",https://www.google.com/maps/place/Kampung+Wisata+Prenggan+Kotagede/data=!4m7!3m6!1s0x2e7a5796dd76a631:0xe42517672992f577!8m2!3d-7.8265222!4d110.3918679!16s%2Fg%2F11s9czv_8n!19sChIJMaZ23ZZXei4Rd_WSKWcXJeQ?authuser=0&hl=id&rclk=1,"{""latitude"": -7.826522199999999, ""longitude"": 110.3918679}"
Kampung Wisata Gunungketur (ꦏꦩ꧀ꦥꦸꦁꦮꦶꦱꦠꦒꦸꦤꦸꦁꦏꦺꦠꦸꦂ),22,Tujuan Wisata,"[""Tujuan Wisata""]",4.9,"Jl. Purwanggan No.74, Gunungketur, Pakualaman, Kota Yogyakarta, Daerah Istimewa Yogyakarta 55111",https://www.google.com/maps/place/Kampung+Wisata+Gunungketur+%28%EA%A6%8F%EA%A6%A9%EA%A7%80%EA%A6%A5%EA%A6%B8%EA%A6%81%EA%A6%AE%EA%A6%B6%EA%A6%B1%EA%A6%A0%EA%A6%92%EA%A6%B8%EA%A6%A4%EA%A6%B8%EA%A6%81%EA%A6%8F%EA%A6%BA%EA%A6%A0%EA%A6%B8%EA%A6%82%29/data=!4m7!3m6!1s0x2e7a578b37557855:0x976cb966ab7a3822!8m2!3d-7.798334!4d110.3776827!16s%2Fg%2F11tj2zjp9k!19sChIJVXhVN4tXei4RIjh6q2a5bJc?authuser=0&hl=id&rclk=1,"{""latitude"": -7.798334, ""longitude"": 110.3776827}"
"Begrafplaats van Rijksbestuurder - Pêpatih Dalêm Djogdja , Makam Cendonosari(ꦩꦏꦩ꧀ꦕꦼꦤ꧀ꦝꦺꦴꦤꦺꦴꦱꦫꦶ)",21,Bangunan Bersejarah,"[""Bangunan Bersejarah"", ""Tujuan Wisata""]",4.4,"Jl. Garuda No.429, Wonocatur, Banguntapan, Kec. Banguntapan, Kabupaten Bantul, Daerah Istimewa Yogyakarta 55198","https://www.google.com/maps/place/Begrafplaats+van+Rijksbestuurder+-+P%C3%AApatih+Dal%C3%AAm+Djogdja+,+Makam+Cendonosari%28%EA%A6%A9%EA%A6%8F%EA%A6%A9%EA%A7%80%EA%A6%95%EA%A6%BC%EA%A6%A4%EA%A7%80%EA%A6%9D%EA%A6%BA%EA%A6%B4%EA%A6%A4%EA%A6%BA%EA%A6%B4%EA%A6%B1%EA%A6%AB%EA%A6%B6%29/data=!4m7!3m6!1s0x2e7a575bb5aaa3db:0xfcd24385154841d!8m2!3d-7.8003762!4d110.4111255!16s%2Fg%2F11c0r5l6lb!19sChIJ26OqtVtXei4RHYRUUTgkzQ8?authuser=0&hl=id&rclk=1","{""latitude"": -7.8003762, ""longitude"": 110.4111255}"
Griya Abhipraya Yogyakarta,17,Tujuan Wisata,"[""Tujuan Wisata""]",5.0,"59X7+3W4, Jl. Pangurakan, Ngupasan, Kec. Gondomanan, Kota Yogyakarta, Daerah Istimewa Yogyakarta 55122",https://www.google.com/maps/place/Griya+Abhipraya+Yogyakarta/data=!4m7!3m6!1s0x2e7a57fb311dd5b3:0x5c3ae7197455a80b!8m2!3d-7.8023566!4d110.3648154!16s%2Fg%2F11kbl782yr!19sChIJs9UdMftXei4RC6hVdBnnOlw?authuser=0&hl=id&rclk=1,"{""latitude"": -7.8023565999999995, ""longitude"": 110.3648154}"
Embung Giwangan,11,Tujuan Wisata,"[""Tujuan Wisata""]",4.3,"Jl. Tegalturi No.41, Giwangan, Kec. Umbulharjo, Kota Yogyakarta, Daerah Istimewa Yogyakarta 55163",https://www.google.com/maps/place/Embung+Giwangan/data=!4m7!3m6!1s0x2e7a57c7c33c67c5:0xc7fca388cda6b568!8m2!3d-7.8249889!4d110.3866389!16s%2Fg%2F11l29drt3k!19sChIJxWc8w8dXei4RaLWmzYij_Mc?authuser=0&hl=id&rclk=1,"{""latitude"": -7.824988899999999, ""longitude"": 110.3866389}"
Napak Tilas Seventeen - Graffiti Street Mantrijeron,11,Tujuan Wisata,"[""Tujuan Wisata""]",4.7,"Jl. Tirtodipuran No.36, Mantrijeron, Kec. Mantrijeron, Kota Yogyakarta, Daerah Istimewa Yogyakarta 55143",https://www.google.com/maps/place/Napak+Tilas+Seventeen+-+Graffiti+Street+Mantrijeron/data=!4m7!3m6!1s0x2e7a57f85daa1489:0x9f78370b72baba3b!8m2!3d-7.818743!4d110.365244!16s%2Fg%2F11ty7b3ncq!19sChIJiRSqXfhXei4RO7q6cgs3eJ8?authuser=0&hl=id&rclk=1,"{""latitude"": -7.8187429999999996, ""longitude"": 110.36524399999999}"
Kampung Wisata Pajeksan,9,Tujuan Wisata,"[""Tujuan Wisata""]",4.6,"Jl. Pajeksan No.4, Ngupasan, Kec. Gondomanan, Kota Yogyakarta, Daerah Istimewa Yogyakarta 55122",https://www.google.com/maps/place/Kampung+Wisata+Pajeksan/data=!4m7!3m6!1s0x2e7a57881f2bd693:0xf5a3b0c9a5216c3b!8m2!3d-7.7963794!4d110.3653113!16s%2Fg%2F11c1q8kc_1!19sChIJk9YrH4hXei4RO2whpcmwo_U?authuser=0&hl=id&rclk=1,"{""latitude"": -7.796379399999999, ""longitude"": 110.3653113}"
Desa Wisata Sungai Code Jogja Kota,8,Tujuan Wisata,"[""Tujuan Wisata""]",4.8,"Jl. Lowanu, Rw 16 Mulyorejo, Sorosutan, Kec. Umbulharjo, Kota Yogyakarta, Daerah Istimewa Yogyakarta 55153",https://www.google.com/maps/place/Desa+Wisata+Sungai+Code+Jogja+Kota/data=!4m7!3m6!1s0x2e7a57a8934200db:0xb78e33e22bb6ee86!8m2!3d-7.8229089!4d110.3756894!16s%2Fg%2F11h2gwpb96!19sChIJ2wBCk6hXei4Rhu62K-Izjrc?authuser=0&hl=id&rclk=1,"{""latitude"": -7.8229089, ""longitude"": 110.3756894}"
Monumen Loko Diesel Bima Kunthing,7,Tujuan Wisata,"[""Tujuan Wisata""]",4.3,"6928+22P, Jl. Jend. Ahmad Yani, Ngupasan, Kec. Gondomanan, Kota Yogyakarta, Daerah Istimewa Yogyakarta 55122",https://www.google.com/maps/place/Monumen+Loko+Diesel+Bima+Kunthing/data=!4m7!3m6!1s0x2e7a57144b3a466b:0x9e24b103a36a4e87!8m2!3d-7.7999002!4d110.3650813!16s%2Fg%2F11hzxjvjny!19sChIJa0Y6SxRXei4Rh05qowOxJJ4?authuser=0&hl=id&rclk=1,"{""latitude"": -7.7999002, ""longitude"": 110.3650813}"
Lukis Wajah Jogja,5,Tujuan Wisata,"[""Tujuan Wisata""]",5.0,"Ps. Beringharjo, Jl. Margo Mulyo, Ngupasan, Kec. Gondomanan, Kota Yogyakarta, Daerah Istimewa Yogyakarta 55122",https://www.google.com/maps/place/Lukis+Wajah+Jogja/data=!4m7!3m6!1s0x2e7a5780aca2e5b1:0x753d7d522f66b80b!8m2!3d-7.7989897!4d110.3652335!16s%2Fg%2F11tnj67cby!19sChIJseWirIBXei4RC7hmL1J9PXU?authuser=0&hl=id&rclk=1,"{""latitude"": -7.7989897, ""longitude"": 110.36523349999999}"
Pojok beteng jl. ibu ruswo,5,Tujuan Wisata,"[""Tujuan Wisata""]",4.4,"59W8+JJ4, Jl. Ibu Ruswo, Prawirodirjan, Kec. Gondomanan, Kota Yogyakarta, Daerah Istimewa Yogyakarta 55131",https://www.google.com/maps/place/Pojok+beteng+jl.+ibu+ruswo/data=!4m7!3m6!1s0x2e7a57b7a78ed299:0x94b4d464cf436b!8m2!3d-7.8034876!4d110.3665867!16s%2Fg%2F11k6l4sfny!19sChIJmdKOp7dXei4Ra0PPZNS0lAA?authuser=0&hl=id&rclk=1,"{""latitude"": -7.8034875999999995, ""longitude"": 110.3665867}"
Toko Semlidut - Oleh Oleh Jogja,5,Tujuan Wisata,"[""Tujuan Wisata""]",4.8,"Jl. Komp. Taman Sari, Patehan, Kecamatan Kraton, Kota Yogyakarta, Daerah Istimewa Yogyakarta 55133",https://www.google.com/maps/place/Toko+Semlidut+-+Oleh+Oleh+Jogja/data=!4m7!3m6!1s0x2e7a57dbc94697c5:0x9d45471f7fe62f17!8m2!3d-7.8103517!4d110.3600562!16s%2Fg%2F11v17j1pgb!19sChIJxZdGydtXei4RFy_mfx9HRZ0?authuser=0&hl=id&rclk=1,"{""latitude"": -7.8103517, ""longitude"": 110.36005619999999}"
Parkir bus taman pintar,4,Tujuan Wisata,"[""Tujuan Wisata""]",5.0,"59X9+76M, Jl. Secodiningratan, Prawirodirjan, Kec. Gondomanan, Kota Yogyakarta, Daerah Istimewa Yogyakarta 55121",https://www.google.com/maps/place/Parkir+bus+taman+pintar/data=!4m7!3m6!1s0x2e7a57006c8a64a3:0xe6c518593594fb8a!8m2!3d-7.801672!4d110.3680244!16s%2Fg%2F11lcypdpc8!19sChIJo2SKbABXei4RivuUNVkYxeY?authuser=0&hl=id&rclk=1,"{""latitude"": -7.801672, ""longitude"": 110.3680244}"
Agro Tainment Wisata Kampung Markisa,3,Tujuan Wisata,"[""Tujuan Wisata""]",5.0,"Blunyahrejo, Karangwaru, Kec. Tegalrejo, Kota Yogyakarta, Daerah Istimewa Yogyakarta 55241",https://www.google.com/maps/place/Agro+Tainment+Wisata+Kampung+Markisa/data=!4m7!3m6!1s0x2e7a59b7ac5a838f:0x280a09d2d9918fc1!8m2!3d-7.774189!4d110.3647986!16s%2Fg%2F11kfc781hw!19sChIJj4NarLdZei4RwY-R2dIJCig?authuser=0&hl=id&rclk=1,"{""latitude"": -7.774189, ""longitude"": 110.3647986}"
Bintang Pradana Jogja Tour,1,Tujuan Wisata,"[""Tujuan Wisata""]",4.0,"Jl. Pogung Rejo SIA XVI No.A-08, Pogung Kidul, Sinduadi, Kec. Mlati, Kabupaten Sleman, Daerah Istimewa Yogyakarta 55284",https://www.google.com/maps/place/Bintang+Pradana+Jogja+Tour/data=!4m7!3m6!1s0x2e7a5965fb5139fd:0xbf2b47adeffff952!8m2!3d-7.7593783!4d110.3716453!16s%2Fg%2F11h6yw9lq3!19sChIJ_TlR-2VZei4RUvn_761HK78?authuser=0&hl=id&rclk=1,"{""latitude"": -7.7593783, ""longitude"": 110.3716453}"
"KeTani Makmur, TR",1,Tujuan Wisata,"[""Tujuan Wisata""]",5.0,"69C7+5V8, Kampung Bangirejo TR.II, RT./RW/RW.: 039, 011, Karangwaru, Kec. Tegalrejo, Kota Yogyakarta, Daerah Istimewa Yogyakarta","https://www.google.com/maps/place/KeTani+Makmur,+TR/data=!4m7!3m6!1s0x2e7a59e310c20d83:0xe9ea9ae4f23a3bad!8m2!3d-7.7795793!4d110.3646937!16s%2Fg%2F11vhy873_v!19sChIJgw3CEONZei4RrTs68uSa6uk?authuser=0&hl=id&rclk=1","{""latitude"": -7.7795793, ""longitude"": 110.36469369999999}"
Sekretariat Desa Wisata Suryatman Danurejan Yogyakarta,1,Tujuan Wisata,"[""Tujuan Wisata""]",5.0,"6939+HFW, Jl. Jomblangan, Suryatmajan, Kec. Danurejan, Kota Yogyakarta, Daerah Istimewa Yogyakarta 55213",https://www.google.com/maps/place/Sekretariat+Desa+Wisata+Suryatman+Danurejan+Yogyakarta/data=!4m7!3m6!1s0x2e7a57fa4fea636d:0x9a0ac5fe78e181e!8m2!3d-7.7961291!4d110.3686929!16s%2Fg%2F11twqppknr!19sChIJbWPqT_pXei4RHhiO51-soAk?authuser=0&hl=id&rclk=1,"{""latitude"": -7.7961291, ""longitude"": 110.3686929}"
Tripoin Kota Yogyakarta - Bantul - Sleman,1,Tujuan Wisata,"[""Tujuan Wisata""]",5.0,"69J2+PCC, Jl. Dukuh Tambak, Tambi, Trihanggo, Kec. Gamping, Kabupaten Sleman, Daerah Istimewa Yogyakarta 55291",https://www.google.com/maps/place/Tripoin+Kota+Yogyakarta+-+Bantul+-+Sleman/data=!4m7!3m6!1s0x2e7a59f91131d061:0xbeafa5191192d347!8m2!3d-7.7681916!4d110.3510165!16s%2Fg%2F11vdz9skkt!19sChIJYdAxEflZei4RR9OSERmlr74?authuser=0&hl=id&rclk=1,"{""latitude"": -7.7681916, ""longitude"": 110.3510165}"
Yogyakarta View,1,Tujuan Wisata,"[""Tujuan Wisata""]",5.0,"6968+2F7, Jl. Malioboro, Sosromenduran, Gedong Tengen, Kota Yogyakarta, Daerah Istimewa Yogyakarta 55271",https://www.google.com/maps/place/Yogyakarta+View/data=!4m7!3m6!1s0x2e7a590032037db1:0x1d973028554f997d!8m2!3d-7.7899518!4d110.366161!16s%2Fg%2F11vx4dww2c!19sChIJsX0DMgBZei4RfZlPVSgwlx0?authuser=0&hl=id&rclk=1,"{""latitude"": -7.7899518, ""longitude"": 110.36616099999999}"
Gesta Store,0,Tujuan Wisata,"[""Tujuan Wisata""]",0.0,"Ngupasan, Karsttubing, Kota Yogyakarta, Daerah Istimewa Yogyakarta",https://www.google.com/maps/place/Gesta+Store/data=!4m7!3m6!1s0x2e7a5751c53709c9:0x625c0a999b6389ad!8m2!3d-7.8013672!4d110.3647568!16s%2Fg%2F11vwk9lbx_!19sChIJyQk3xVFXei4RrYljm5kKXGI?authuser=0&hl=id&rclk=1,"{""latitude"": -7.8013672, ""longitude"": 110.3647568}"
Kali code.꧋ꦏꦭꦶꦕꦺꦴꦣꦺ,0,Tujuan Wisata,"[""Tujuan Wisata""]",0.0,"59PG+G3P, Keparakan, Kec. Mergangsan, Kota Yogyakarta, Daerah Istimewa Yogyakarta 55152",https://www.google.com/maps/place/Kali+code.%EA%A7%8B%EA%A6%8F%EA%A6%AD%EA%A6%B6%EA%A6%95%EA%A6%BA%EA%A6%B4%EA%A6%A3%EA%A6%BA/data=!4m7!3m6!1s0x2e7a573a3c7cd6e1:0x70b2b2318f090b8a!8m2!3d-7.8136603!4d110.3752134!16s%2Fg%2F11k4xpdx5f!19sChIJ4dZ8PDpXei4RigsJjzGysnA?authuser=0&hl=id&rclk=1,"{""latitude"": -7.8136603, ""longitude"": 110.37521339999999}"
Ko traveling,0,Tujuan Wisata,"[""Tujuan Wisata""]",0.0,"Jl. Sagan, Terban, Kec. Gondokusuman, Kota Yogyakarta, Daerah Istimewa Yogyakarta 55221",https://www.google.com/maps/place/Ko+traveling/data=!4m7!3m6!1s0x2e7a5902bd4f78d7:0xcc2d90505b9cf90d!8m2!3d-7.7810314!4d110.3776709!16s%2Fg%2F11vq16dxjr!19sChIJ13hPvQJZei4RDfmcW1CQLcw?authuser=0&hl=id&rclk=1,"{""latitude"": -7.7810314, ""longitude"": 110.3776709}"
Kota Yogyakarta,0,,,0.0,Daerah Istimewa Yogyakarta,https://www.google.com/maps/place/Kota+Yogyakarta/data=!4m7!3m6!1s0x2e7a5783a80c7c19:0x4b880677539abaa!8m2!3d-7.7974565!4d110.370697!16s%2Fg%2F11bzzzl_y3!19sChIJGXwMqINXei4Rqqs5dWeAuAQ?authuser=0&hl=id&rclk=1,"{""latitude"": -7.7974565, ""longitude"": 110.37069699999999}"
MOGU' TOJUK GELUH,0,Tujuan Wisata,"[""Tujuan Wisata""]",0.0,"6968+6CP, Jl. P. Mangkubumi, Sosromenduran, Gedong Tengen, Kota Yogyakarta, Daerah Istimewa Yogyakarta 55271",https://www.google.com/maps/place/MOGU%27+TOJUK+GELUH/data=!4m7!3m6!1s0x2e7a590c4198075b:0x5a854161b019989e!8m2!3d-7.7891888!4d110.3660684!16s%2Fg%2F11kqvl2vy1!19sChIJWweYQQxZei4RnpgZsGFBhVo?authuser=0&hl=id&rclk=1,"{""latitude"": -7.7891888, ""longitude"": 110.36606839999999}"
Trotoarsisibaratmalioboro,0,Tujuan Wisata,"[""Tujuan Wisata""]",0.0,"Jl. Malioboro No.189a, Sosromenduran, Gedong Tengen, Kota Yogyakarta, Daerah Istimewa Yogyakarta 55271",https://www.google.com/maps/place/Trotoarsisibaratmalioboro/data=!4m7!3m6!1s0x2e7a59004d311dc9:0x6d3863c409810855!8m2!3d-7.7903026!4d110.3661046!16s%2Fg%2F11vz82_7n4!19sChIJyR0xTQBZei4RVQiBCcRjOG0?authuser=0&hl=id&rclk=1,"{""latitude"": -7.7903025999999995, ""longitude"": 110.3661046}"
malioboro ꧋ꦩꦭꦶꦪꦺꦴꦧꦺꦴꦫꦺꦴ,0,Tujuan Wisata,"[""Tujuan Wisata""]",0.0,"6967+3Q3, Jl. Ps. Kembang, Sosromenduran, Gedong Tengen, Kota Yogyakarta, Daerah Istimewa Yogyakarta",https://www.google.com/maps/place/malioboro+%EA%A7%8B%EA%A6%A9%EA%A6%AD%EA%A6%B6%EA%A6%AA%EA%A6%BA%EA%A6%B4%EA%A6%A7%EA%A6%BA%EA%A6%B4%EA%A6%AB%EA%A6%BA%EA%A6%B4/data=!4m7!3m6!1s0x2e7a593f5ee74241:0x848a7ceff8ab6ae6!8m2!3d-7.7898648!4d110.3644125!16s%2Fg%2F11kb1w25pp!19sChIJQULnXj9Zei4R5mqr-O98ioQ?authuser=0&hl=id&rclk=1,"{""latitude"": -7.789864799999999, ""longitude"": 110.3644125}"
꧋ꦄꦥꦄꦗ,0,Tujuan Wisata,"[""Tujuan Wisata""]",0.0,"Jl. Patehan Tengah No.20a, Patehan, Kecamatan Kraton, Kota Yogyakarta, Daerah Istimewa Yogyakarta 55133",https://www.google.com/maps/place/%EA%A7%8B%EA%A6%84%EA%A6%A5%EA%A6%84%EA%A6%97/data=!4m7!3m6!1s0x2e7a57cb20be4c43:0xd569fe09f11122eb!8m2!3d-7.8126043!4d110.3605467!16s%2Fg%2F11sj5zvb1h!19sChIJQ0y-IMtXei4R6yIR8Qn-adU?authuser=0&hl=id&rclk=1,"{""latitude"": -7.812604299999999, ""longitude"": 110.3605467}"
